{
  "contract_version": "knowledge-graph/1",
  "edge_kinds": {
    "boundary": {
      "origin_types": [],
      "target_types": [
        "boundary"
      ],
      "minimum": 1,
      "maximum": 1,
      "inverse_maximum": null,
      "traversed": true,
      "depth": 1,
      "crosses_context": true
    },
    "depends_on": {
      "origin_types": [],
      "target_types": [],
      "minimum": 0,
      "maximum": null,
      "inverse_maximum": null,
      "traversed": true,
      "depth": 2,
      "crosses_context": false
    },
    "governed_by": {
      "origin_types": [],
      "target_types": [
        "adr"
      ],
      "minimum": 0,
      "maximum": null,
      "inverse_maximum": null,
      "traversed": true,
      "depth": 1,
      "crosses_context": true
    },
    "attributes[].target": {
      "origin_types": [
        "definition"
      ],
      "target_types": [
        "definition"
      ],
      "minimum": 0,
      "maximum": null,
      "inverse_maximum": null,
      "traversed": true,
      "depth": 1,
      "crosses_context": false
    },
    "attributes[].of": {
      "origin_types": [
        "definition"
      ],
      "target_types": [
        "definition"
      ],
      "minimum": 0,
      "maximum": null,
      "inverse_maximum": null,
      "traversed": true,
      "depth": 1,
      "crosses_context": false
    },
    "attributes[].lifecycle": {
      "origin_types": [
        "definition"
      ],
      "target_types": [
        "lifecycle"
      ],
      "minimum": 0,
      "maximum": null,
      "inverse_maximum": null,
      "traversed": true,
      "depth": 1,
      "crosses_context": false
    },
    "lifecycle.subject": {
      "origin_types": [
        "lifecycle"
      ],
      "target_types": [
        "definition"
      ],
      "minimum": 1,
      "maximum": 1,
      "inverse_maximum": 1,
      "traversed": true,
      "depth": 1,
      "crosses_context": false
    },
    "transitions[].guard": {
      "origin_types": [
        "lifecycle"
      ],
      "target_types": [
        "rule"
      ],
      "minimum": 0,
      "maximum": null,
      "inverse_maximum": null,
      "traversed": true,
      "depth": 1,
      "crosses_context": false
    },
    "rejections[].error": {
      "origin_types": [
        "lifecycle"
      ],
      "target_types": [
        "definition"
      ],
      "minimum": 0,
      "maximum": null,
      "inverse_maximum": null,
      "traversed": true,
      "depth": 1,
      "crosses_context": false
    },
    "steps[].ko": {
      "origin_types": [
        "process"
      ],
      "target_types": [],
      "minimum": 0,
      "maximum": null,
      "inverse_maximum": null,
      "traversed": true,
      "depth": 1,
      "crosses_context": false
    },
    "context_relationships[].with": {
      "origin_types": [
        "boundary"
      ],
      "target_types": [
        "boundary"
      ],
      "minimum": 0,
      "maximum": null,
      "inverse_maximum": null,
      "traversed": true,
      "depth": 1,
      "crosses_context": true
    }
  },
  "nodes": [
    {
      "id": "adr.0001",
      "kind": "adr",
      "title": "Fix the proposal validity window at thirty days",
      "status": "proposed"
    },
    {
      "id": "ko.boundary.billing",
      "kind": "boundary",
      "title": "Billing",
      "status": "proposed",
      "question": "What does the Billing context own?",
      "ddd": "bounded-context"
    },
    {
      "id": "ko.boundary.billing.invoice",
      "kind": "boundary",
      "title": "Invoice aggregate",
      "status": "proposed",
      "question": "What is inside the Invoice aggregate?",
      "boundary": "ko.boundary.billing",
      "context": "ko.boundary.billing",
      "ddd": "aggregate"
    },
    {
      "id": "ko.boundary.sales",
      "kind": "boundary",
      "title": "Sales",
      "status": "proposed",
      "question": "What does the Sales context own?",
      "ddd": "bounded-context"
    },
    {
      "id": "ko.boundary.sales.customer",
      "kind": "boundary",
      "title": "Customer aggregate",
      "status": "proposed",
      "question": "What is inside the Customer aggregate?",
      "boundary": "ko.boundary.sales",
      "context": "ko.boundary.sales",
      "ddd": "aggregate"
    },
    {
      "id": "ko.boundary.sales.proposal",
      "kind": "boundary",
      "title": "Proposal aggregate",
      "status": "proposed",
      "question": "What is inside the Proposal aggregate?",
      "boundary": "ko.boundary.sales",
      "context": "ko.boundary.sales",
      "ddd": "aggregate"
    },
    {
      "id": "ko.definition.billing.invoice",
      "kind": "definition",
      "title": "Invoice",
      "status": "proposed",
      "question": "What is an Invoice?",
      "boundary": "ko.boundary.billing.invoice",
      "context": "ko.boundary.billing",
      "ddd": "aggregate-root"
    },
    {
      "id": "ko.definition.billing.invoice-already-issued",
      "kind": "definition",
      "title": "Invoice already issued",
      "status": "proposed",
      "question": "Which error does a second issue of one invoice raise?",
      "boundary": "ko.boundary.billing.invoice",
      "context": "ko.boundary.billing",
      "ddd": "domain-error"
    },
    {
      "id": "ko.definition.billing.invoice-not-issued",
      "kind": "definition",
      "title": "Invoice not issued",
      "status": "proposed",
      "question": "Which error does a draft invoice raise for a payment?",
      "boundary": "ko.boundary.billing.invoice",
      "context": "ko.boundary.billing",
      "ddd": "domain-error"
    },
    {
      "id": "ko.definition.billing.invoice-terminal",
      "kind": "definition",
      "title": "Invoice terminal",
      "status": "proposed",
      "question": "Which error does a paid invoice raise for any trigger?",
      "boundary": "ko.boundary.billing.invoice",
      "context": "ko.boundary.billing",
      "ddd": "domain-error"
    },
    {
      "id": "ko.definition.sales.customer",
      "kind": "definition",
      "title": "Customer",
      "status": "proposed",
      "question": "What is a Customer?",
      "boundary": "ko.boundary.sales.customer",
      "context": "ko.boundary.sales",
      "ddd": "aggregate-root"
    },
    {
      "id": "ko.definition.sales.customer-proposals",
      "kind": "definition",
      "title": "Customer proposals",
      "status": "proposed",
      "question": "Which proposals are open for a customer?",
      "boundary": "ko.boundary.sales",
      "context": "ko.boundary.sales",
      "ddd": "read-model"
    },
    {
      "id": "ko.definition.sales.proposal",
      "kind": "definition",
      "title": "Proposal",
      "status": "proposed",
      "question": "What is a Proposal?",
      "boundary": "ko.boundary.sales.proposal",
      "context": "ko.boundary.sales",
      "ddd": "aggregate-root"
    },
    {
      "id": "ko.definition.sales.proposal-already-issued",
      "kind": "definition",
      "title": "Proposal already issued",
      "status": "proposed",
      "question": "Which error does a second issue of one proposal raise?",
      "boundary": "ko.boundary.sales.proposal",
      "context": "ko.boundary.sales",
      "ddd": "domain-error"
    },
    {
      "id": "ko.definition.sales.proposal-expired",
      "kind": "definition",
      "title": "Proposal expired",
      "status": "proposed",
      "question": "Which error does an expired proposal raise?",
      "boundary": "ko.boundary.sales.proposal",
      "context": "ko.boundary.sales",
      "ddd": "domain-error"
    },
    {
      "id": "ko.definition.sales.proposal-item",
      "kind": "definition",
      "title": "Proposal item",
      "status": "proposed",
      "question": "What is a Proposal item?",
      "boundary": "ko.boundary.sales.proposal",
      "context": "ko.boundary.sales",
      "ddd": "value-object"
    },
    {
      "id": "ko.definition.sales.proposal-not-issued",
      "kind": "definition",
      "title": "Proposal not issued",
      "status": "proposed",
      "question": "Which error does a draft proposal raise for a trigger requiring issue?",
      "boundary": "ko.boundary.sales.proposal",
      "context": "ko.boundary.sales",
      "ddd": "domain-error"
    },
    {
      "id": "ko.definition.sales.proposal-terminal",
      "kind": "definition",
      "title": "Proposal terminal",
      "status": "proposed",
      "question": "Which error does a terminal proposal raise for any trigger?",
      "boundary": "ko.boundary.sales.proposal",
      "context": "ko.boundary.sales",
      "ddd": "domain-error"
    },
    {
      "id": "ko.interface.billing.payment-received",
      "kind": "interface",
      "title": "Payment received",
      "status": "proposed",
      "question": "What does Billing consume when a payment settles?",
      "boundary": "ko.boundary.billing",
      "context": "ko.boundary.billing",
      "ddd": "integration-event"
    },
    {
      "id": "ko.interface.sales.contract-signed",
      "kind": "interface",
      "title": "Contract signed",
      "status": "proposed",
      "question": "What does Sales publish when a proposal is accepted?",
      "boundary": "ko.boundary.sales",
      "context": "ko.boundary.sales",
      "ddd": "domain-event"
    },
    {
      "id": "ko.lifecycle.billing.invoice",
      "kind": "lifecycle",
      "title": "Invoice lifecycle",
      "status": "proposed",
      "question": "Which states may an invoice hold, and which transitions are legal?",
      "boundary": "ko.boundary.billing.invoice",
      "context": "ko.boundary.billing"
    },
    {
      "id": "ko.lifecycle.sales.proposal",
      "kind": "lifecycle",
      "title": "Proposal lifecycle",
      "status": "proposed",
      "question": "Which states may a proposal hold, and which transitions are legal?",
      "boundary": "ko.boundary.sales.proposal",
      "context": "ko.boundary.sales"
    },
    {
      "id": "ko.process.billing.invoice-issue",
      "kind": "process",